{
  "format": "cuexis.project",
  "version": 1,
  "projectId": "019f0000-0000-7abc-8def-000000000901",
  "assetRoots": [
    {
      "id": "main",
      "path": "assets"
    }
  ],
  "entry": {
    "chart": {
      "root": "main",
      "path": "charts/demo20s.cuexis.chart.json"
    }
  },
  "extensions": {}
}
